{
  "goals" : [
    {
      "attribute" : "harshness",
      "direction" : "decrease",
      "locked" : false,
      "strength" : 0.75
    },
    {
      "attribute" : "clarity",
      "direction" : "preserve",
      "locked" : true,
      "strength" : 0.75
    }
  ],
  "nodes" : [
    {
      "category" : "corrective",
      "confidence" : 0.58,
      "enabled" : true,
      "id" : "93964DFE-C49E-4090-8516-2A7A85ABB537",
      "locked" : false,
      "parameters" : {
        "frequencyHz" : 4800,
        "gainDB" : -5.1,
        "q" : 1.2
      },
      "rationale" : "Test a bounded source-specific presence-band reduction while preserving articulation.",
      "type" : "parametricEQ"
    },
    {
      "category" : "loudness",
      "confidence" : 1,
      "enabled" : true,
      "id" : "AA1D1236-15F0-5328-B631-0560089BA8B8",
      "locked" : false,
      "parameters" : {
        "gainDB" : 0.06931329328826408
      },
      "rationale" : "Persist the measured preview compensation so the audition and committed processing are identical.",
      "type" : "loudnessMatch"
    },
    {
      "category" : "loudness",
      "confidence" : 0.9,
      "enabled" : true,
      "id" : "7CCB333F-D3C9-4BB3-BFB4-F8809873EB27",
      "locked" : false,
      "parameters" : {
        "ceilingDB" : -3,
        "lookaheadMS" : 0,
        "releaseMS" : 80
      },
      "rationale" : "Catch unsafe sample peaks with inter-sample margin; rendered true peak and loudness matching are measured separately.",
      "type" : "limiter"
    }
  ],
  "outputConstraints" : {
    "loudnessMatchPreview" : true,
    "maxAddedGainDB" : 6,
    "maxTruePeakDB" : -1,
    "preserveMonoCompatibility" : true
  },
  "requestID" : "E65C537B-15F0-4328-B631-0560089BA8B8",
  "schemaVersion" : "1.0",
  "scope" : {
    "channelFormat" : "mono",
    "kind" : "importedFile",
    "sourceType" : "vocal",
    "timeRangeSeconds" : {
      "end" : 0.5,
      "start" : 0
    }
  },
  "sourceSnapshotID" : "CE6A90FB-808F-4EBF-BEEC-FA4D60013D12"
}