{
  "goals" : [
    {
      "attribute" : "clarity",
      "direction" : "increase",
      "locked" : false,
      "strength" : 0.4
    },
    {
      "attribute" : "brightness",
      "direction" : "doNotIncrease",
      "locked" : true,
      "strength" : 0.5
    }
  ],
  "nodes" : [
    {
      "category" : "corrective",
      "confidence" : 0.58,
      "enabled" : true,
      "id" : "B7BF212F-46A0-4C84-BC57-E33724AC6892",
      "locked" : false,
      "parameters" : {
        "frequencyHz" : 310,
        "gainDB" : -0.9,
        "q" : 0.9
      },
      "rationale" : "Reduce a source-specific masking candidate without equating the band measurement with a semantic verdict.",
      "type" : "parametricEQ"
    },
    {
      "category" : "loudness",
      "confidence" : 1,
      "enabled" : true,
      "id" : "5900B4B8-046C-5EAB-8527-FF11EFCCB7FD",
      "locked" : false,
      "parameters" : {
        "gainDB" : 0.3643029769124517
      },
      "rationale" : "Persist the measured preview compensation so the audition and committed processing are identical.",
      "type" : "loudnessMatch"
    },
    {
      "category" : "loudness",
      "confidence" : 0.9,
      "enabled" : true,
      "id" : "3B3211A6-C927-48C2-A4EE-A061F2BC833D",
      "locked" : false,
      "parameters" : {
        "ceilingDB" : -3,
        "lookaheadMS" : 0,
        "releaseMS" : 80
      },
      "rationale" : "Catch unsafe sample peaks with inter-sample margin; rendered true peak and loudness matching are measured separately.",
      "type" : "limiter"
    }
  ],
  "outputConstraints" : {
    "loudnessMatchPreview" : true,
    "maxAddedGainDB" : 6,
    "maxTruePeakDB" : -1,
    "preserveMonoCompatibility" : true
  },
  "requestID" : "1541F5F5-046C-4EAB-8527-FF11EFCCB7FD",
  "schemaVersion" : "1.0",
  "scope" : {
    "channelFormat" : "stereo",
    "kind" : "importedFile",
    "sourceType" : "fullMix",
    "timeRangeSeconds" : {
      "end" : 0.5,
      "start" : 0
    }
  },
  "sourceSnapshotID" : "91939A3F-9322-49E2-8A06-70C5DBCD42D0"
}