{
  "goals" : [
    {
      "attribute" : "closeness",
      "direction" : "increase",
      "locked" : false,
      "strength" : 1
    },
    {
      "attribute" : "clarity",
      "direction" : "increase",
      "locked" : false,
      "strength" : 1
    },
    {
      "attribute" : "brightness",
      "direction" : "preserve",
      "locked" : true,
      "strength" : 1
    }
  ],
  "nodes" : [
    {
      "category" : "corrective",
      "confidence" : 0.74,
      "enabled" : true,
      "id" : "9EDE7A83-8716-4882-8306-1B2773BE830E",
      "locked" : false,
      "parameters" : {
        "attackMS" : 16.839970652670974,
        "kneeDB" : 7.25,
        "makeupGainDB" : 0,
        "mix" : 0.6525000000000001,
        "ratio" : 2.925,
        "releaseMS" : 193.6596625057162,
        "thresholdDB" : -15.625825871081473
      },
      "rationale" : "Test a bounded dynamics-led interpretation because the validated hypothesis selected compression; this does not prove the production adjective.",
      "type" : "compressor"
    },
    {
      "category" : "loudness",
      "confidence" : 1,
      "enabled" : true,
      "id" : "1EF016FC-85BC-5DC5-8226-90FF7B744462",
      "locked" : false,
      "parameters" : {
        "gainDB" : 2.1580790108730703
      },
      "rationale" : "Persist the measured preview compensation so the audition and committed processing are identical.",
      "type" : "loudnessMatch"
    },
    {
      "category" : "loudness",
      "confidence" : 0.9,
      "enabled" : true,
      "id" : "672689F8-3DBD-43ED-B2D5-845CC3000C85",
      "locked" : false,
      "parameters" : {
        "ceilingDB" : -3,
        "lookaheadMS" : 0,
        "releaseMS" : 80
      },
      "rationale" : "Catch unsafe sample peaks with inter-sample margin; rendered true peak and loudness matching are measured separately.",
      "type" : "limiter"
    }
  ],
  "outputConstraints" : {
    "loudnessMatchPreview" : true,
    "maxAddedGainDB" : 6,
    "maxTruePeakDB" : -1,
    "preserveMonoCompatibility" : true
  },
  "requestID" : "52B157B1-85BC-4DC5-8226-90FF7B744462",
  "schemaVersion" : "1.0",
  "scope" : {
    "channelFormat" : "mono",
    "kind" : "importedFile",
    "sourceType" : "vocal",
    "timeRangeSeconds" : {
      "end" : 0.5,
      "start" : 0
    }
  },
  "sourceSnapshotID" : "C9D0CF46-7970-4252-9CC0-24E273E05B31"
}