{
  "goals" : [
    {
      "attribute" : "sibilance",
      "direction" : "decrease",
      "locked" : false,
      "strength" : 1
    },
    {
      "attribute" : "closeness",
      "direction" : "preserve",
      "locked" : true,
      "strength" : 1
    }
  ],
  "nodes" : [
    {
      "category" : "corrective",
      "confidence" : 0.72,
      "enabled" : true,
      "id" : "03A36021-2F0F-474B-A51F-0C846DBA2024",
      "locked" : false,
      "parameters" : {
        "attackMS" : 1.5,
        "frequencyHz" : 6500,
        "mix" : 0.9500000000000001,
        "ratio" : 5.7,
        "releaseMS" : 70,
        "thresholdDB" : -37.39009867424256
      },
      "rationale" : "Use event-relative upper-band attenuation and preserve air/intelligibility; whole-capture brightness is not treated as sibilance.",
      "type" : "deEsser"
    },
    {
      "category" : "loudness",
      "confidence" : 1,
      "enabled" : true,
      "id" : "039BBA86-107B-5D9D-9BD4-2334EFC15391",
      "locked" : false,
      "parameters" : {
        "gainDB" : 0.059961807438915216
      },
      "rationale" : "Persist the measured preview compensation so the audition and committed processing are identical.",
      "type" : "loudnessMatch"
    },
    {
      "category" : "loudness",
      "confidence" : 0.9,
      "enabled" : true,
      "id" : "13A9DC4E-CD84-4766-B866-9B43C4756EE6",
      "locked" : false,
      "parameters" : {
        "ceilingDB" : -3,
        "lookaheadMS" : 0,
        "releaseMS" : 80
      },
      "rationale" : "Catch unsafe sample peaks with inter-sample margin; rendered true peak and loudness matching are measured separately.",
      "type" : "limiter"
    }
  ],
  "outputConstraints" : {
    "loudnessMatchPreview" : true,
    "maxAddedGainDB" : 6,
    "maxTruePeakDB" : -1,
    "preserveMonoCompatibility" : true
  },
  "requestID" : "4FDAFBCB-107B-4D9D-9BD4-2334EFC15391",
  "schemaVersion" : "1.0",
  "scope" : {
    "channelFormat" : "mono",
    "kind" : "importedFile",
    "sourceType" : "vocal",
    "timeRangeSeconds" : {
      "end" : 0.5,
      "start" : 0
    }
  },
  "sourceSnapshotID" : "194088AA-A3A5-405C-904B-90E0B1760378"
}