{
  "goals" : [
    {
      "attribute" : "clarity",
      "direction" : "increase",
      "locked" : false,
      "strength" : 1
    },
    {
      "attribute" : "lowEnd",
      "direction" : "preserve",
      "locked" : true,
      "strength" : 1
    },
    {
      "attribute" : "muddiness",
      "direction" : "doNotIncrease",
      "locked" : true,
      "strength" : 1
    }
  ],
  "nodes" : [
    {
      "category" : "corrective",
      "confidence" : 0.58,
      "enabled" : true,
      "id" : "D7B9F103-6929-4B14-8F34-3102AAA4E677",
      "locked" : false,
      "parameters" : {
        "frequencyHz" : 240,
        "gainDB" : -5.4,
        "q" : 0.9
      },
      "rationale" : "Reduce a source-specific masking candidate without equating the band measurement with a semantic verdict.",
      "type" : "parametricEQ"
    },
    {
      "category" : "loudness",
      "confidence" : 1,
      "enabled" : true,
      "id" : "5BB1334F-A0D9-52E9-AFD7-B48D01B0C2E3",
      "locked" : false,
      "parameters" : {
        "gainDB" : 0.9329208216634814
      },
      "rationale" : "Persist the measured preview compensation so the audition and committed processing are identical.",
      "type" : "loudnessMatch"
    },
    {
      "category" : "loudness",
      "confidence" : 0.9,
      "enabled" : true,
      "id" : "8154760A-D0D2-4003-AB95-7629C526DEAC",
      "locked" : false,
      "parameters" : {
        "ceilingDB" : -3,
        "lookaheadMS" : 0,
        "releaseMS" : 80
      },
      "rationale" : "Catch unsafe sample peaks with inter-sample margin; rendered true peak and loudness matching are measured separately.",
      "type" : "limiter"
    }
  ],
  "outputConstraints" : {
    "loudnessMatchPreview" : true,
    "maxAddedGainDB" : 6,
    "maxTruePeakDB" : -1,
    "preserveMonoCompatibility" : true
  },
  "requestID" : "17F07202-A0D9-42E9-AFD7-B48D01B0C2E3",
  "schemaVersion" : "1.0",
  "scope" : {
    "channelFormat" : "mono",
    "kind" : "importedFile",
    "sourceType" : "bass",
    "timeRangeSeconds" : {
      "end" : 0.5,
      "start" : 0
    }
  },
  "sourceSnapshotID" : "DD4360D2-EC6A-4015-B875-02D908CEB1F0"
}