{
  "goals" : [
    {
      "attribute" : "closeness",
      "direction" : "increase",
      "locked" : false,
      "strength" : 0.25
    },
    {
      "attribute" : "brightness",
      "direction" : "preserve",
      "locked" : true,
      "strength" : 0.25
    }
  ],
  "nodes" : [
    {
      "category" : "corrective",
      "confidence" : 0.58,
      "enabled" : true,
      "id" : "3285291A-08C6-426F-A4CE-2D0D413C178E",
      "locked" : false,
      "parameters" : {
        "frequencyHz" : 4500,
        "gainDB" : 0.6,
        "q" : 0.65
      },
      "rationale" : "Test a bounded upper-band change while monitoring event-specific harshness and sibilance.",
      "type" : "parametricEQ"
    },
    {
      "category" : "loudness",
      "confidence" : 1,
      "enabled" : true,
      "id" : "8BC6C584-92FE-5666-BE5C-04B1BD399A68",
      "locked" : false,
      "parameters" : {
        "gainDB" : -0.0234091989836962
      },
      "rationale" : "Persist the measured preview compensation so the audition and committed processing are identical.",
      "type" : "loudnessMatch"
    },
    {
      "category" : "loudness",
      "confidence" : 0.9,
      "enabled" : true,
      "id" : "5290DD75-58ED-4673-9EC7-9DC9B810E7A0",
      "locked" : false,
      "parameters" : {
        "ceilingDB" : -3,
        "lookaheadMS" : 0,
        "releaseMS" : 80
      },
      "rationale" : "Catch unsafe sample peaks with inter-sample margin; rendered true peak and loudness matching are measured separately.",
      "type" : "limiter"
    }
  ],
  "outputConstraints" : {
    "loudnessMatchPreview" : true,
    "maxAddedGainDB" : 6,
    "maxTruePeakDB" : -1,
    "preserveMonoCompatibility" : true
  },
  "requestID" : "C78784C9-92FE-4666-BE5C-04B1BD399A68",
  "schemaVersion" : "1.0",
  "scope" : {
    "channelFormat" : "mono",
    "kind" : "importedFile",
    "sourceType" : "vocal",
    "timeRangeSeconds" : {
      "end" : 0.5,
      "start" : 0
    }
  },
  "sourceSnapshotID" : "E7FBF7ED-8D96-4121-A433-ADAFAAA103A6"
}