{
  "goals" : [
    {
      "attribute" : "clarity",
      "direction" : "increase",
      "locked" : false,
      "strength" : 0.75
    },
    {
      "attribute" : "brightness",
      "direction" : "preserve",
      "locked" : true,
      "strength" : 0.75
    }
  ],
  "nodes" : [
    {
      "category" : "corrective",
      "confidence" : 0.58,
      "enabled" : true,
      "id" : "DB12962C-0C26-4311-AA3D-B50DAA26347C",
      "locked" : false,
      "parameters" : {
        "frequencyHz" : 330,
        "gainDB" : -2.7,
        "q" : 0.9
      },
      "rationale" : "Reduce a source-specific masking candidate without equating the band measurement with a semantic verdict.",
      "type" : "parametricEQ"
    },
    {
      "category" : "loudness",
      "confidence" : 1,
      "enabled" : true,
      "id" : "2DB2E3F4-4746-5210-ABA8-524DB2562FB5",
      "locked" : false,
      "parameters" : {
        "gainDB" : 0.7743803188509641
      },
      "rationale" : "Persist the measured preview compensation so the audition and committed processing are identical.",
      "type" : "loudnessMatch"
    },
    {
      "category" : "loudness",
      "confidence" : 0.9,
      "enabled" : true,
      "id" : "683A6072-2D16-437F-8DDA-EC8D646CEF14",
      "locked" : false,
      "parameters" : {
        "ceilingDB" : -3,
        "lookaheadMS" : 0,
        "releaseMS" : 80
      },
      "rationale" : "Catch unsafe sample peaks with inter-sample margin; rendered true peak and loudness matching are measured separately.",
      "type" : "limiter"
    }
  ],
  "outputConstraints" : {
    "loudnessMatchPreview" : true,
    "maxAddedGainDB" : 6,
    "maxTruePeakDB" : -1,
    "preserveMonoCompatibility" : true
  },
  "requestID" : "61F3A2B9-4746-4210-ABA8-524DB2562FB5",
  "schemaVersion" : "1.0",
  "scope" : {
    "channelFormat" : "stereo",
    "kind" : "importedFile",
    "sourceType" : "synth",
    "timeRangeSeconds" : {
      "end" : 0.5,
      "start" : 0
    }
  },
  "sourceSnapshotID" : "D3999619-13E3-4977-B517-B53C636BF7D8"
}