{
  "goals" : [
    {
      "attribute" : "clarity",
      "direction" : "increase",
      "locked" : false,
      "strength" : 0.6
    },
    {
      "attribute" : "dynamicControl",
      "direction" : "increase",
      "locked" : false,
      "strength" : 0.6
    }
  ],
  "nodes" : [
    {
      "category" : "corrective",
      "confidence" : 0.72,
      "enabled" : true,
      "id" : "0E220FC4-83A7-41D8-B118-254D399FD383",
      "locked" : false,
      "parameters" : {
        "frequencyHz" : 280,
        "gainDB" : -0.32000000000000006,
        "q" : 1.1
      },
      "rationale" : "Reduce a restrained amount of boxy low-mid energy.",
      "type" : "parametricEQ"
    },
    {
      "category" : "corrective",
      "confidence" : 0.7,
      "enabled" : true,
      "id" : "DB27E51C-7C23-4E1B-B058-8B737DC1F980",
      "locked" : false,
      "parameters" : {
        "frequencyHz" : 3200,
        "gainDB" : 0.25,
        "q" : 0.85
      },
      "rationale" : "Add presence for intelligibility without relying on output level.",
      "type" : "parametricEQ"
    },
    {
      "category" : "corrective",
      "confidence" : 0.82,
      "enabled" : true,
      "id" : "00A0C13B-FD44-4F36-9C1B-9D06400A77BC",
      "locked" : false,
      "parameters" : {
        "attackMS" : 13.553144436088834,
        "kneeDB" : 4.6,
        "makeupGainDB" : 0,
        "mix" : 1,
        "ratio" : 1.586,
        "releaseMS" : 155.86116101502157,
        "thresholdDB" : -12.6249183060241
      },
      "rationale" : "Reference threshold and timing to the captured signal instead of applying a fixed compressor preset.",
      "type" : "compressor"
    },
    {
      "category" : "loudness",
      "confidence" : 1,
      "enabled" : true,
      "id" : "469E8F05-EC40-5AD0-A13F-5FE9D033C06A",
      "locked" : false,
      "parameters" : {
        "gainDB" : 0.4140823331376282
      },
      "rationale" : "Persist the measured preview compensation so the audition and committed processing are identical.",
      "type" : "loudnessMatch"
    },
    {
      "category" : "loudness",
      "confidence" : 0.9,
      "enabled" : true,
      "id" : "8236051F-AD2B-4A81-8C10-D6BA3D755E34",
      "locked" : false,
      "parameters" : {
        "ceilingDB" : -1,
        "lookaheadMS" : 0,
        "releaseMS" : 80
      },
      "rationale" : "Catch unsafe sample peaks; this is not used as a loudness maximizer.",
      "type" : "limiter"
    }
  ],
  "outputConstraints" : {
    "loudnessMatchPreview" : true,
    "maxAddedGainDB" : 12,
    "maxTruePeakDB" : -1,
    "preserveMonoCompatibility" : true
  },
  "requestID" : "0ADFCE48-EC40-4AD0-A13F-5FE9D033C06A",
  "schemaVersion" : "1.0",
  "scope" : {
    "channelFormat" : "mono",
    "kind" : "importedFile",
    "sourceType" : "unknown",
    "timeRangeSeconds" : {
      "end" : 6.199727891156463,
      "start" : 0
    }
  },
  "sourceSnapshotID" : "ED8E0F5E-BE7B-4DE8-8501-32D410CCC81D"
}