{
  "goals" : [
    {
      "attribute" : "punch",
      "direction" : "increase",
      "locked" : false,
      "strength" : 1
    },
    {
      "attribute" : "harshness",
      "direction" : "doNotIncrease",
      "locked" : true,
      "strength" : 1
    }
  ],
  "nodes" : [
    {
      "category" : "corrective",
      "confidence" : 0.74,
      "enabled" : true,
      "id" : "9EFD0454-16DA-4F8C-B576-30DF6E2B0244",
      "locked" : false,
      "parameters" : {
        "attackMS" : 24,
        "kneeDB" : 7.25,
        "makeupGainDB" : 0,
        "mix" : 0.5525,
        "ratio" : 2.925,
        "releaseMS" : 65,
        "thresholdDB" : -19.583128586953702
      },
      "rationale" : "Use source- and crest-dependent ballistics with a slower attack and parallel dry path to preserve leading transients.",
      "type" : "compressor"
    },
    {
      "category" : "loudness",
      "confidence" : 1,
      "enabled" : true,
      "id" : "891EDCC8-E8D8-5113-9192-C55FDDEC393C",
      "locked" : false,
      "parameters" : {
        "gainDB" : 1.137869107438366
      },
      "rationale" : "Persist the measured preview compensation so the audition and committed processing are identical.",
      "type" : "loudnessMatch"
    },
    {
      "category" : "loudness",
      "confidence" : 0.9,
      "enabled" : true,
      "id" : "5C985D93-959F-4CC3-ACCE-9166BFE4C6CA",
      "locked" : false,
      "parameters" : {
        "ceilingDB" : -3,
        "lookaheadMS" : 0,
        "releaseMS" : 80
      },
      "rationale" : "Catch unsafe sample peaks with inter-sample margin; rendered true peak and loudness matching are measured separately.",
      "type" : "limiter"
    }
  ],
  "outputConstraints" : {
    "loudnessMatchPreview" : true,
    "maxAddedGainDB" : 6,
    "maxTruePeakDB" : -1,
    "preserveMonoCompatibility" : true
  },
  "requestID" : "C55F9D85-E8D8-4113-9192-C55FDDEC393C",
  "schemaVersion" : "1.0",
  "scope" : {
    "channelFormat" : "mono",
    "kind" : "importedFile",
    "sourceType" : "guitar",
    "timeRangeSeconds" : {
      "end" : 0.5,
      "start" : 0
    }
  },
  "sourceSnapshotID" : "6DE5601A-CE48-41DB-8166-7F34ACA84CB0"
}