{
  "goals" : [
    {
      "attribute" : "harshness",
      "direction" : "decrease",
      "locked" : false,
      "strength" : 1
    },
    {
      "attribute" : "punch",
      "direction" : "preserve",
      "locked" : true,
      "strength" : 1
    }
  ],
  "nodes" : [
    {
      "category" : "corrective",
      "confidence" : 0.58,
      "enabled" : true,
      "id" : "57A8547B-BCC2-4D5C-BE72-C7A890E8160E",
      "locked" : false,
      "parameters" : {
        "frequencyHz" : 3200,
        "gainDB" : -10.2,
        "q" : 1.2
      },
      "rationale" : "Test a bounded source-specific presence-band reduction while preserving articulation.",
      "type" : "parametricEQ"
    },
    {
      "category" : "loudness",
      "confidence" : 1,
      "enabled" : true,
      "id" : "4DE25423-4688-58DC-BB65-A4994AFE26A1",
      "locked" : false,
      "parameters" : {
        "gainDB" : 0.15813261805822165
      },
      "rationale" : "Persist the measured preview compensation so the audition and committed processing are identical.",
      "type" : "loudnessMatch"
    },
    {
      "category" : "loudness",
      "confidence" : 0.9,
      "enabled" : true,
      "id" : "07CE575A-88DA-40B3-B7D6-F0891108EEB1",
      "locked" : false,
      "parameters" : {
        "ceilingDB" : -3,
        "lookaheadMS" : 0,
        "releaseMS" : 80
      },
      "rationale" : "Catch unsafe sample peaks with inter-sample margin; rendered true peak and loudness matching are measured separately.",
      "type" : "limiter"
    }
  ],
  "outputConstraints" : {
    "loudnessMatchPreview" : true,
    "maxAddedGainDB" : 6,
    "maxTruePeakDB" : -1,
    "preserveMonoCompatibility" : true
  },
  "requestID" : "01A3156E-4688-48DC-BB65-A4994AFE26A1",
  "schemaVersion" : "1.0",
  "scope" : {
    "channelFormat" : "mono",
    "kind" : "importedFile",
    "sourceType" : "guitar",
    "timeRangeSeconds" : {
      "end" : 0.5,
      "start" : 0
    }
  },
  "sourceSnapshotID" : "13DE8D01-6B18-43B3-9ECB-8CE34E8675A2"
}