{
  "goals" : [
    {
      "attribute" : "dynamicControl",
      "direction" : "increase",
      "locked" : false,
      "strength" : 0.75
    },
    {
      "attribute" : "dynamicControl",
      "direction" : "preserve",
      "locked" : true,
      "strength" : 0.75
    }
  ],
  "nodes" : [
    {
      "category" : "corrective",
      "confidence" : 0.74,
      "enabled" : true,
      "id" : "205B24D6-81DD-4147-BED9-FEB3FBB3F44D",
      "locked" : false,
      "parameters" : {
        "attackMS" : 24,
        "kneeDB" : 7.25,
        "makeupGainDB" : 0,
        "mix" : 0.5525,
        "ratio" : 2.925,
        "releaseMS" : 65,
        "thresholdDB" : -25.478758360085326
      },
      "rationale" : "Control signal-relative variability while preserving the explicitly protected dynamics or onset when present.",
      "type" : "compressor"
    },
    {
      "category" : "loudness",
      "confidence" : 1,
      "enabled" : true,
      "id" : "21356DDD-6BA6-5B66-83E6-E168332A42DB",
      "locked" : false,
      "parameters" : {
        "gainDB" : 0.7799874235803266
      },
      "rationale" : "Persist the measured preview compensation so the audition and committed processing are identical.",
      "type" : "loudnessMatch"
    },
    {
      "category" : "loudness",
      "confidence" : 0.9,
      "enabled" : true,
      "id" : "C59A9D91-8C6F-4279-8298-507A392AD138",
      "locked" : false,
      "parameters" : {
        "ceilingDB" : -3,
        "lookaheadMS" : 0,
        "releaseMS" : 80
      },
      "rationale" : "Catch unsafe sample peaks with inter-sample margin; rendered true peak and loudness matching are measured separately.",
      "type" : "limiter"
    }
  ],
  "outputConstraints" : {
    "loudnessMatchPreview" : true,
    "maxAddedGainDB" : 6,
    "maxTruePeakDB" : -1,
    "preserveMonoCompatibility" : true
  },
  "requestID" : "6D742C90-6BA6-4B66-83E6-E168332A42DB",
  "schemaVersion" : "1.0",
  "scope" : {
    "channelFormat" : "stereo",
    "kind" : "importedFile",
    "sourceType" : "drums",
    "timeRangeSeconds" : {
      "end" : 0.5,
      "start" : 0
    }
  },
  "sourceSnapshotID" : "C139F1C6-6495-401B-88E7-A0CF1E543C0D"
}