{
  "goals" : [
    {
      "attribute" : "dynamicControl",
      "direction" : "increase",
      "locked" : false,
      "strength" : 1
    },
    {
      "attribute" : "dynamicControl",
      "direction" : "preserve",
      "locked" : true,
      "strength" : 1
    }
  ],
  "nodes" : [
    {
      "category" : "corrective",
      "confidence" : 0.74,
      "enabled" : true,
      "id" : "452DE1A1-F205-4291-A1F5-F1F95E2FFD00",
      "locked" : false,
      "parameters" : {
        "attackMS" : 56.937369422029114,
        "kneeDB" : 8.75,
        "makeupGainDB" : 0,
        "mix" : 0.6875,
        "ratio" : 4.075,
        "releaseMS" : 338.4610293420619,
        "thresholdDB" : -15.387990241987278
      },
      "rationale" : "Control signal-relative variability while preserving the explicitly protected dynamics or onset when present.",
      "type" : "compressor"
    },
    {
      "category" : "loudness",
      "confidence" : 1,
      "enabled" : true,
      "id" : "2E60FFC4-80AC-5B37-A711-E0ABD530B321",
      "locked" : false,
      "parameters" : {
        "gainDB" : 2.421184513883269
      },
      "rationale" : "Persist the measured preview compensation so the audition and committed processing are identical.",
      "type" : "loudnessMatch"
    },
    {
      "category" : "loudness",
      "confidence" : 0.9,
      "enabled" : true,
      "id" : "9507669D-4CDA-435D-B2FB-40CBD2039370",
      "locked" : false,
      "parameters" : {
        "ceilingDB" : -3,
        "lookaheadMS" : 0,
        "releaseMS" : 80
      },
      "rationale" : "Catch unsafe sample peaks with inter-sample margin; rendered true peak and loudness matching are measured separately.",
      "type" : "limiter"
    }
  ],
  "outputConstraints" : {
    "loudnessMatchPreview" : true,
    "maxAddedGainDB" : 6,
    "maxTruePeakDB" : -1,
    "preserveMonoCompatibility" : true
  },
  "requestID" : "6221BE89-80AC-4B37-A711-E0ABD530B321",
  "schemaVersion" : "1.0",
  "scope" : {
    "channelFormat" : "mono",
    "kind" : "importedFile",
    "sourceType" : "bass",
    "timeRangeSeconds" : {
      "end" : 0.5,
      "start" : 0
    }
  },
  "sourceSnapshotID" : "922F0610-2944-4FCD-93CD-CF7570A98FB7"
}